{
  "id": "urn:ngsi-ld:DigitalAssetMetric:Acme:GA4:P1D",
  "type": "DigitalAssetMetric",
  "dateObserved": "2026-02-07T00:00:00Z",
  "temporalResolution": "P1D",
  "refDigitalAsset": "urn:ngsi-ld:DigitalAsset:Acme-GA4",
  "refDataProvider": "urn:ngsi-ld:DataProvider:Acme-Internal-Pipeline",

  "sessions": [
    { "channelGroup": "Direct",         "value": 25.0 },
    { "channelGroup": "Cross-network",  "value": 20.0 },
    { "channelGroup": "Paid Search",    "value": 33.0 },
    { "channelGroup": "Organic Search", "value": 6.0  },
    { "channelGroup": "Organic Social", "value": 5.0  },
    { "channelGroup": "Paid Social",    "value": 32.0 },
    { "channelGroup": "Referral",       "value": 6.0  },
    { "channelGroup": "Email",          "value": 2.0  },
    { "channelGroup": "Unassigned",     "value": 3.0  }
  ],
  "purchaseRevenue": [
    { "channelGroup": "Direct",       "value": 21.0 },
    { "channelGroup": "Email",        "value": 4.01 },
    { "channelGroup": "Organic Search", "value": 8.00 },
    { "channelGroup": "Paid Search",  "value": 4.04 },
    { "channelGroup": "Referral",     "value": 7.94 }
  ],

  "newUsers": 86,
  "engagedSessions": 72,
  "userEngagementDuration": 5925,
  "pageViews": 292,
  "keyEvents": 28,
  "itemsPurchased": 0,
  "itemViewEvents": 71,
  "addToCarts": 0,
  "checkouts": 0,

  "organicAveragePosition": 20.0279792746114,
  "organicClicks": 2
}
