{
  "id": "urn:ngsi-ld:DigitalAssetMetric:Acme:GA4:P1M",
  "type": "DigitalAssetMetric",
  "dateObserved": "2026-02-01T00:00:00Z",
  "temporalResolution": "P1M",
  "refDigitalAsset": "urn:ngsi-ld:DigitalAsset:Acme-GA4",
  "refDataProvider": "urn:ngsi-ld:DataProvider:Acme-Internal-Pipeline",

  "sessions": [
    { "channelGroup": "Direct",         "value": 760 },
    { "channelGroup": "Cross-network",  "value": 542 },
    { "channelGroup": "Paid Search",    "value": 980 },
    { "channelGroup": "Organic Search", "value": 165 },
    { "channelGroup": "Organic Social", "value": 142 },
    { "channelGroup": "Paid Social",    "value": 870 },
    { "channelGroup": "Referral",       "value": 198 },
    { "channelGroup": "Email",          "value": 62  },
    { "channelGroup": "Unassigned",     "value": 81  }
  ],
  "purchaseRevenue": [
    { "channelGroup": "Direct",         "value": 612.0 },
    { "channelGroup": "Email",          "value": 124.5 },
    { "channelGroup": "Organic Search", "value": 245.0 },
    { "channelGroup": "Paid Search",    "value": 410.7 },
    { "channelGroup": "Referral",       "value": 220.0 }
  ],
  "totalRevenue": [
    { "channelGroup": "Direct",         "value": 612.0 },
    { "channelGroup": "Email",          "value": 124.5 },
    { "channelGroup": "Organic Search", "value": 245.0 },
    { "channelGroup": "Paid Search",    "value": 410.7 },
    { "channelGroup": "Referral",       "value": 220.0 }
  ],
  "keyEventsPurchase": [
    { "channelGroup": "Direct",         "value": 12 },
    { "channelGroup": "Paid Search",    "value": 8  }
  ],

  "newUsers": 2480,
  "totalUsers": 3120,
  "activeUsers": 2865,
  "engagedSessions": 2210,
  "userEngagementDuration": 178500,
  "pageViews": 8920,
  "keyEvents": 802,
  "totalPurchasers": 78,
  "firstTimePurchasers": 54,
  "itemsPurchased": 142,
  "itemViewEvents": 2110,
  "addToCarts": 412,
  "checkouts": 168,
  "ecommercePurchases": 78,
  "transactions": 78,

  "organicAveragePosition": 18.4,
  "organicClicks": 65,
  "organicImpressions": 4820,
  "organicKeywordCount": 412
}
