{
  "id": "urn:ngsi-ld:DigitalAssetMetric:Acme:LinkedIn:P1D",
  "type": "DigitalAssetMetric",
  "dateObserved": "2026-02-07T00:00:00Z",
  "temporalResolution": "P1D",
  "refDigitalAsset": "urn:ngsi-ld:DigitalAsset:Acme-LinkedIn",
  "refDataProvider": "urn:ngsi-ld:DataProvider:Acme-Internal-Pipeline",

  "organicFollowers": 4820,
  "organicFollowersGained": 18,
  "organicFollowersLost": 3,
  "organicImpressions": 12450,
  "organicClicks": 187,
  "organicLikes": 92,
  "organicComments": 14,
  "organicShares": 8,
  "organicReactions": 121,
  "organicInteractions": 143,
  "organicReach": 9740,
  "organicEngagementTime": 612,

  "adsSpend": 350.45,
  "adsClicks": 245,
  "adsImpressions": 38200,
  "adsReach": 21300,
  "adsLikes": 56,
  "adsComments": 7,
  "adsShares": 4,
  "adsInteractions": 67,
  "adsConversions": 12,
  "adsRevenue": 1820.0,
  "adsFollows": 9
}
